{"schema_version":"1.0.0","policy_id":"amxo-host-policy-v1","unobserved_fields":["read_only_input_file_digests","file_contents","process_memory_contents","in_memory_synthesis_contents","streamed_payload_digests","streamed_payload_contents","network_payload_contents"],"prohibited_export_fields":["raw_nono_record","command","path","url","error","file_contents","memory_contents","streamed_payload_digest","streamed_payload_contents","network_payload_contents"],"raw_paths_exported":false,"raw_urls_exported":false,"raw_errors_exported":false,"integrity_implies_completeness":false,"integrity_implies_host_trust":false,"evidence_retention_days":30,"deletion_deadline_days":7,"retention_owner":"ControlPlane Signal Loom Operations","deletion_owner":"ControlPlane Signal Loom Operations","host_unenrollment_owner":"AgentMaxxing Platform Engineering","deletion_trigger":"verified-tenant-request-or-host-unenrollment","revocation_semantics":"audit-only-independent-no-evidence-rewrite"}
